{
  "$schema": "http://json-schema.org/draft-04/schema#",
  "id": "http://moj.gov.uk/cps/stagingprosecutors/domain/event/public.prosecutioncasefile.prosecution-submission-succeeded-with-warnings.json",
  "type": "object",
  "properties": {
    "caseId": {
      "$ref": "http://justice.gov.uk/domain/core/common/definitions.json#/definitions/uuid"
    },
    "warnings": {
      "type": "array",
      "items": {
        "$ref": "http://cpp.moj.gov.uk/staging/prosecutors/json/schemas/problem.json"
      }
    },
    "caseWarnings": {
      "type": "array",
      "items": {
        "$ref": "http://cpp.moj.gov.uk/staging/prosecutors/json/schemas/problem.json"
      }
    },
    "defendantWarnings": {
      "type": "array",
      "items": {
        "$ref": "http://cpp.moj.gov.uk/staging/prosecutors/json/schemas/defendant-problem.json"
      }
    },
    "externalId": {
      "$ref": "http://justice.gov.uk/domain/core/common/definitions.json#/definitions/uuid",
      "description": "ID originating from the client (SPI or CPPI) for referencing the original message"
    },
    "channel": {
      "type": "string",
      "$ref": "http://cpp.moj.gov.uk/prosecution/casefile/json/schemas/pcf-definitions.json#/definitions/channel"
    }
  },
  "required": [
    "caseId",
    "channel"
  ]
}